{"seed":42,"max_plies":200,"verdict":"Evidence pending (logical baseline; performance parity evidence pending)","q1_rollouts_st":{"measured":false,"time_ratio":1.0000,"haskell_games_per_second":0.0000,"cpp_imperative_games_per_second":0.0000},"q1_rollouts_mt8":{"measured":false,"time_ratio":1.0000,"haskell_games_per_second":0.0000,"cpp_imperative_games_per_second":0.0000},"q2_selfplay_st":{"measured":false,"time_ratio":1.0000,"haskell_games_per_second":0.0000,"cpp_imperative_games_per_second":0.0000},"q2_selfplay_mt8":{"measured":false,"time_ratio":1.0000,"haskell_games_per_second":0.0000,"cpp_imperative_games_per_second":0.0000},"q5_haskell_scaling":{"measured":false,"scaling_ratio":1.0000,"single_games_per_second":0.0000,"multi_games_per_second":0.0000},"q5_cpp_imperative_scaling":{"measured":false,"scaling_ratio":1.0000,"single_games_per_second":0.0000,"multi_games_per_second":0.0000},"divergence_matrix":[{"backend":"rust","cells":[{"backend":"rust","visit":0.0000,"move":0.0000},{"backend":"haskell","visit":0.0000,"move":0.0000}]},{"backend":"haskell","cells":[{"backend":"rust","visit":0.0000,"move":0.0000},{"backend":"haskell","visit":0.0000,"move":0.0000}]}]}